Index,Title,URL,Time(UTC)
0,Ontario teachers' unions slam province for considering permanent online learning,https://beta.ctvnews.ca/local/toronto/2021/5/5/1_5415237.html,2021-05-09 06:00:08
1,Machine Learning Accelerates Cosmological Simulations,https://www.cmu.edu/ai-physics-institute/news/2021-05-05_supersims.html,2021-05-09 06:00:08
2,RL-IoT: Towards IoT Interoperability via Reinforcement Learning,https://arxiv.org/abs/2105.00884,2021-05-08 00:00:11
3,High-Quality Deep Fake audio and video with only 40 seconds sample training time,https://www.youtube.com/watch?v=iXqLTJFTUGc,2021-05-08 00:00:33
4,MarioNette: Self-Supervised Sprite Learning,https://arxiv.org/abs/2104.14553,2021-05-08 18:00:11
5,Fungus-like organisms in deep time and deep rock,https://natureecoevocommunity.nature.com/posts/16369-fungus-like-organisms-in-deep-time-and-deep-rock,2021-05-08 18:00:11
6,Adversarial Reprogramming of Neural Cellular Automata,https://distill.pub/selforg/2021/adversarial,2021-05-07 00:00:10
7,Liquids and Useless Knowledge,https://johnhellion.substack.com/p/liquids-and-useless-knowledge,2021-05-07 18:00:22
8,How college became a ruthless competition divorced from learning,https://www.theatlantic.com/ideas/archive/2021/05/marriage-college-status-meritocracy/618795/,2021-05-07 18:00:36
9,Ruby Garbage Collection Deep Dive: Compaction,https://jemma.dev/blog/gc-compaction,2021-05-07 18:00:49
10,Knowledge Graphs with Inductive Logic Programming,https://blogs.sap.com/2021/05/06/knowledge-graphs-with-inductive-logic-programming-on-cml21/,2021-05-07 18:00:49
11,Genetic Mapping,https://maisonneuve.org/article/2021/04/12/genetic-mapping/,2021-05-06 00:00:13
12,2021 Perception Sensor Industry Map,https://www.tangramvision.com/blog/the-2021-perception-sensor-industry-map,2021-05-06 00:00:17
13,"Google user asks Google support for help, user ends up helping support employee",https://twitter.com/RaveofRavendale/status/1389507928269393921/,2021-05-06 00:00:24
14,A false facial recognition match sent this innocent Black man to jail,https://edition.cnn.com/2021/04/29/tech/nijeer-parks-facial-recognition-police-arrest/index.html,2021-05-06 00:00:29
15,Machine learning accelerates cosmological simulations,https://phys.org/news/2021-05-machine-cosmological-simulations.html,2021-05-06 06:00:12
16,US declares support for patent waiver on Covid-19 vaccines,https://www.theguardian.com/world/2021/may/05/us-declares-support-for-patent-waiver-on-covid-19-vaccines,2021-05-06 06:00:16
17,Deep Diving into the Strengths of FreeBSD,https://klarasystems.com/articles/deep-diving-into-the-strengths-of-freebsd/,2021-05-06 09:11:30
18,Bold Adversarial Journalism: The Intercept Does the Feds Work,https://twitter.com/ggreenwald/status/1389722584804102148,2021-05-06 09:12:35
19,Safaribooks: Download and generate ePub from O'Reilly Learning library,https://github.com/lorenzodifuccia/safaribooks,2021-05-05 12:00:30
20,"Dogecoin Is Surging Again, for Some Actual Reasons",https://nymag.com/intelligencer/2021/05/dogecoin-is-surging-again-and-for-some-actual-reasons.html,2021-05-05 12:00:41
21,Engineering professor solves deep earthquake mystery,https://phys.org/news/2021-04-professor-deep-earthquake-mystery.html,2021-05-05 12:01:07
22,The UML was designed to be a language for just visualizing and reasoning,https://twitter.com/Grady_Booch/status/1388929894915080193,2021-05-05 12:01:19
23,Constructor Theory,https://en.wikipedia.org/wiki/Constructor_theory,2021-05-05 12:01:41
24,Learning About the GeoTIFF File Format with a Hex Editor (2018),https://medium.com/planet-stories/a-handy-introduction-to-cloud-optimized-geotiffs-1f2c9e716ec3,2021-05-05 18:00:10
25,Case decision 2021-001-FB-FBR,https://oversightboard.com/decision/FB-691QAMHJ/,2021-05-05 18:00:29
26,Facebook will uphold Trump ban but reassess the decision over coming months,https://www.cnbc.com/2021/05/05/facebook-will-keep-trump-ban-in-place.html,2021-05-05 18:00:53
27,"Back in 1993, I was taking a number theory class",https://twitter.com/EricLengyel/status/1389106103179378689,2021-05-04 09:00:12
28,Request for comments regarding topics to be discussed at Dark Patterns workshop,https://www.regulations.gov/document/FTC-2021-0019-0001/comment,2021-05-04 09:00:17
29,Programming in Z3 by learning to think like a compiler,https://bellmar.medium.com/programming-in-z3-by-learning-to-think-like-a-compiler-401fd46828d5,2021-05-04 09:00:17
30,Google AI leader has defected to Apple,https://arstechnica.com/gadgets/2021/05/apple-hires-yet-another-ex-google-ai-leader/,2021-05-04 09:00:24
31,Andrew Ng says AI has a proof-of-concept-to-production gap,https://spectrum.ieee.org/view-from-the-valley/artificial-intelligence/machine-learning/andrew-ng-xrays-the-ai-hype,2021-05-04 09:00:24
32,Using Neural Networks to Refute Conjectures in Combinatorics,https://arxiv.org/abs/2104.14516,2021-05-04 09:00:24
33,I was terrible at crosswords so I built an AI to do them,https://www.bbc.co.uk/news/technology-56934716,2021-05-04 09:00:31
34,Arduino Based Robotic Pixar Lamp,https://www.youtube.com/watch?v=_yW5P49TVJ8,2021-05-04 09:00:44
35,About 1.5M people still pay for AOL (but for tech support and id theft s/w),https://www.cnbc.com/2021/05/03/aol-1point5-million-people-still-pay-for-service-but-not-for-dial-up-internet.html,2021-05-04 09:00:44
36,Technology helped archaeologists dig deeper,https://www.technologyreview.com/2021/04/28/1022982/data-archaeology-ancient-city-grid-burial-site/,2021-05-04 09:00:50
37,Erik Stolterman: Design Theory and Philosophy,https://www.designdisciplin.com/erik-stolterman/,2021-05-03 09:00:14
38,A whale who tried to mimic human speech (2014),https://www.smithsonianmag.com/science-nature/story-one-whale-who-tried-bridge-linguistic-divide-between-animals-humans-180951437/,2021-05-03 09:00:18
39,Onepanel – Cloud native deep learning platform,https://github.com/onepanelio/onepanel,2021-05-03 09:00:25
40,Show HN: Segmentel – Let AI segment videos for you,http://www.segmentel.com,2021-05-03 09:00:45
41,VMware Fusion will not support x86 emulation on Apple Silicon,https://blogs.vmware.com/teamfusion/2021/04/fusion-on-apple-silicon-progress-update.html,2021-05-03 09:00:52
42,The 11th Reason to Delete Your Social Media Account: The Algorithm Will Find You,http://simondedeo.com/?p=705,2021-05-03 09:00:58
43,Category theory is a universal modeling language,http://math.mit.edu/~dspivak/informatics/,2021-05-03 09:00:58
44,Murex shell now supports mixing SQL and shell pipelines,https://murex.rocks/docs/blog/v2.1.html,2021-05-03 09:00:58
45,DPA blocks facial recognition system in Italy and MP proposes moratorium,https://reclaimyourface.eu/italy-dpa-blocks-facial-recognition-system-mp-proposes-moratorium/,2021-05-03 09:01:11
46,Opera adds native support for blockchain domain names,https://blogs.opera.com/tips-and-tricks/2021/04/say-hello-to-web3-as-opera-adds-native-support-to-unstoppable-domains/,2021-05-03 09:01:11
47,Types of Robotics Papers,https://twitter.com/rosorg/status/1388280173036904449,2021-05-03 09:01:11
48,"Cognicull: Knowledge base for mathematics, natural science and engineering",https://cognicull.com/,2021-05-03 09:01:11
49,AI Dungeon public disclosure vulnerability report,https://github.com/AetherDevSecOps/aid_adventure_vulnerability_report,2021-05-03 09:01:11
50,Mining robot stranded on Pacific Ocean floor in deep-sea mining trial,https://www.reuters.com/business/environment/mining-robot-stranded-pacific-ocean-floor-deep-sea-mining-trial-2021-04-28/,2021-05-03 09:01:17
51,The Fourier transform is a neural network,https://sidsite.com/posts/fourier-nets/,2021-05-03 09:01:17
52,U.S. Labor Secretary throws support behind classifying gig workers as employees,https://www.reuters.com/article/us-usa-labor-exclusive/exclusive-u-s-labor-secretary-says-most-gig-workers-should-be-classified-as-employees-idUSKBN2CG1ZS,2021-05-03 09:01:17
53,"AI Dungeon will block certain words, review content flagged as inappropriate",https://latitude.io/blog/update-to-our-community-ai-test-april-2021/,2021-05-03 09:01:22
54,A theory of how developers seek information,https://web.eecs.utk.edu/~azh/blog/informationforaging.html,2021-05-03 09:01:22
55,Show HN: AI powered startup and project name generator,https://namebatao.com/,2021-05-03 09:01:22
56,Diving Deep on S3 Consistency,https://www.allthingsdistributed.com/2021/04/s3-strong-consistency.html,2021-05-03 09:01:28
57,EU court rules software transfer is a sale (2012),https://bdkadvokati.com/eu-court-rules-software-transfer-is-a-sale/,2021-05-03 09:01:28
58,New AI tool calculates materials’ stress and strain based on photos,https://news.mit.edu/2021/ai-materials-stress-strain-0422,2021-05-03 09:01:28
59,Geometric Deep Learning,https://geometricdeeplearning.com/,2021-05-03 09:01:33
60,Google-led paper pushes back against claims of AI inefficiency,https://venturebeat.com/2021/04/29/google-led-paper-pushes-back-against-claims-of-ai-inefficiency/,2021-05-03 09:01:33
61,Coffee drinkers display a distinct pattern of brain functional connectivity,https://www.nature.com/articles/s41380-021-01075-4,2021-05-03 09:01:41
62,The Challenges of Animal Translation,https://www.newyorker.com/science/elements/the-challenges-of-animal-translation,2021-05-03 09:01:41
63,Building a machine learning model to predict the NBA MVP,https://perthirtysix.com/essay/2021-nba-mvp-race,2021-05-03 09:01:41
64,"This week in KDE: Support for GPU hot-plug and FreeSync, and so much more",https://pointieststick.com/2021/04/30/this-week-in-kde-support-for-gpu-hot-plug-and-freesync-and-so-much-more/,2021-05-03 09:01:41
65,Flower Summit 2021 (The Friendly Federated Learning Framework),https://flower.dev/conf/flower-summit-2021,2021-05-03 09:01:47
66,Classical Reasoning and Debugging,https://thoughtbot.com/blog/classical-reasoning-and-debugging,2021-05-03 09:01:54
67,What We’re Learning About Ingenuity’s Flight Control and Aerodynamic Performance,https://mars.nasa.gov/technology/helicopter/status/298/what-were-learning-about-ingenuitys-flight-control-and-aerodynamic-performance/,2021-05-03 09:01:54
68,The NYPD retires “Digidog” robot after public backlash,https://arstechnica.com/gadgets/2021/04/the-nypd-retires-digidog-robot-after-public-backlash/,2021-05-03 09:02:01
69,Hallucinogen Persisting Perception Disorder,https://en.wikipedia.org/wiki/Hallucinogen_persisting_perception_disorder,2021-05-03 09:02:01
70,A semantic map of all 3.5M story titles ever submitted to Hacker News,https://twitter.com/clured/status/1387395667618897921,2021-05-03 09:02:07
71,Supreme Court wary of giving schools broad authority over off-campus speech,https://www.nbcnews.com/politics/supreme-court/supreme-court-wary-giving-schools-broad-authority-over-campus-speech-n1265681,2021-05-03 09:02:13
72,Robotic harvester plucks an Apple every 7 seconds,https://www.freshplaza.com/article/9316228/robotic-harvester-plucks-an-apple-every-7-seconds/,2021-05-03 09:02:13
73,N.Y.P.D. Robot Dog’s Run Is Cut Short After Fierce Backlash,https://www.nytimes.com/2021/04/28/nyregion/nypd-robot-dog-backlash.html,2021-05-03 09:02:19
74,US tells citizens to leave India As Covid Crisis Deepens,https://www.bloomberg.com/news/articles/2021-04-29/u-s-tells-citizens-to-leave-india-as-covid-19-swamps-hospitals,2021-05-03 09:02:26
