Index,Title,URL,Time(UTC)
0,Adversarial Reprogramming of Neural Cellular Automata,https://distill.pub/selforg/2021/adversarial,2021-05-07 00:00:10
1,Liquids and Useless Knowledge,https://johnhellion.substack.com/p/liquids-and-useless-knowledge,2021-05-07 18:00:22
2,How college became a ruthless competition divorced from learning,https://www.theatlantic.com/ideas/archive/2021/05/marriage-college-status-meritocracy/618795/,2021-05-07 18:00:36
3,Ruby Garbage Collection Deep Dive: Compaction,https://jemma.dev/blog/gc-compaction,2021-05-07 18:00:49
4,Knowledge Graphs with Inductive Logic Programming,https://blogs.sap.com/2021/05/06/knowledge-graphs-with-inductive-logic-programming-on-cml21/,2021-05-07 18:00:49
5,Genetic Mapping,https://maisonneuve.org/article/2021/04/12/genetic-mapping/,2021-05-06 00:00:13
6,2021 Perception Sensor Industry Map,https://www.tangramvision.com/blog/the-2021-perception-sensor-industry-map,2021-05-06 00:00:17
7,"Google user asks Google support for help, user ends up helping support employee",https://twitter.com/RaveofRavendale/status/1389507928269393921/,2021-05-06 00:00:24
8,A false facial recognition match sent this innocent Black man to jail,https://edition.cnn.com/2021/04/29/tech/nijeer-parks-facial-recognition-police-arrest/index.html,2021-05-06 00:00:29
9,Machine learning accelerates cosmological simulations,https://phys.org/news/2021-05-machine-cosmological-simulations.html,2021-05-06 06:00:12
10,US declares support for patent waiver on Covid-19 vaccines,https://www.theguardian.com/world/2021/may/05/us-declares-support-for-patent-waiver-on-covid-19-vaccines,2021-05-06 06:00:16
11,Deep Diving into the Strengths of FreeBSD,https://klarasystems.com/articles/deep-diving-into-the-strengths-of-freebsd/,2021-05-06 09:11:30
12,Bold Adversarial Journalism: The Intercept Does the Feds Work,https://twitter.com/ggreenwald/status/1389722584804102148,2021-05-06 09:12:35
13,Safaribooks: Download and generate ePub from O'Reilly Learning library,https://github.com/lorenzodifuccia/safaribooks,2021-05-05 12:00:30
14,"Dogecoin Is Surging Again, for Some Actual Reasons",https://nymag.com/intelligencer/2021/05/dogecoin-is-surging-again-and-for-some-actual-reasons.html,2021-05-05 12:00:41
15,Engineering professor solves deep earthquake mystery,https://phys.org/news/2021-04-professor-deep-earthquake-mystery.html,2021-05-05 12:01:07
16,The UML was designed to be a language for just visualizing and reasoning,https://twitter.com/Grady_Booch/status/1388929894915080193,2021-05-05 12:01:19
17,Constructor Theory,https://en.wikipedia.org/wiki/Constructor_theory,2021-05-05 12:01:41
18,Learning About the GeoTIFF File Format with a Hex Editor (2018),https://medium.com/planet-stories/a-handy-introduction-to-cloud-optimized-geotiffs-1f2c9e716ec3,2021-05-05 18:00:10
19,Case decision 2021-001-FB-FBR,https://oversightboard.com/decision/FB-691QAMHJ/,2021-05-05 18:00:29
20,Facebook will uphold Trump ban but reassess the decision over coming months,https://www.cnbc.com/2021/05/05/facebook-will-keep-trump-ban-in-place.html,2021-05-05 18:00:53
21,"Back in 1993, I was taking a number theory class",https://twitter.com/EricLengyel/status/1389106103179378689,2021-05-04 09:00:12
22,Programming in Z3 by learning to think like a compiler,https://bellmar.medium.com/programming-in-z3-by-learning-to-think-like-a-compiler-401fd46828d5,2021-05-04 09:00:17
23,Google AI leader has defected to Apple,https://arstechnica.com/gadgets/2021/05/apple-hires-yet-another-ex-google-ai-leader/,2021-05-04 09:00:24
24,Andrew Ng says AI has a proof-of-concept-to-production gap,https://spectrum.ieee.org/view-from-the-valley/artificial-intelligence/machine-learning/andrew-ng-xrays-the-ai-hype,2021-05-04 09:00:24
25,Using Neural Networks to Refute Conjectures in Combinatorics,https://arxiv.org/abs/2104.14516,2021-05-04 09:00:24
26,I was terrible at crosswords so I built an AI to do them,https://www.bbc.co.uk/news/technology-56934716,2021-05-04 09:00:31
27,Arduino Based Robotic Pixar Lamp,https://www.youtube.com/watch?v=_yW5P49TVJ8,2021-05-04 09:00:44
28,About 1.5M people still pay for AOL (but for tech support and id theft s/w),https://www.cnbc.com/2021/05/03/aol-1point5-million-people-still-pay-for-service-but-not-for-dial-up-internet.html,2021-05-04 09:00:44
29,Technology helped archaeologists dig deeper,https://www.technologyreview.com/2021/04/28/1022982/data-archaeology-ancient-city-grid-burial-site/,2021-05-04 09:00:50
30,Request for comments regarding topics to be discussed at Dark Patterns workshop,https://www.regulations.gov/document/FTC-2021-0019-0001/comment,2021-05-03 09:00:10
31,Erik Stolterman: Design Theory and Philosophy,https://www.designdisciplin.com/erik-stolterman/,2021-05-03 09:00:14
32,Onepanel – Cloud native deep learning platform,https://github.com/onepanelio/onepanel,2021-05-03 09:00:25
33,Show HN: AI powered startup and project name generator,https://namebatao.com/,2021-05-03 09:01:22
34,A whale who tried to mimic human speech (2014),https://www.smithsonianmag.com/science-nature/story-one-whale-who-tried-bridge-linguistic-divide-between-animals-humans-180951437/,2021-05-02 08:30:14
35,Show HN: Segmentel – Let AI segment videos for you,http://www.segmentel.com,2021-05-02 08:30:19
36,VMware Fusion will not support x86 emulation on Apple Silicon,https://blogs.vmware.com/teamfusion/2021/04/fusion-on-apple-silicon-progress-update.html,2021-05-02 08:30:19
37,The 11th Reason to Delete Your Social Media Account: The Algorithm Will Find You,http://simondedeo.com/?p=705,2021-05-02 08:30:26
38,Types of Robotics Papers,https://twitter.com/rosorg/status/1388280173036904449,2021-05-02 08:30:33
39,Murex shell now supports mixing SQL and shell pipelines,https://murex.rocks/docs/blog/v2.1.html,2021-05-02 08:30:44
40,Category theory is a universal modeling language,http://math.mit.edu/~dspivak/informatics/,2021-05-02 08:30:52
41,Opera adds native support for blockchain domain names,https://blogs.opera.com/tips-and-tricks/2021/04/say-hello-to-web3-as-opera-adds-native-support-to-unstoppable-domains/,2021-05-02 08:30:52
42,"Cognicull: Knowledge base for mathematics, natural science and engineering",https://cognicull.com/,2021-05-02 08:30:58
43,DPA blocks facial recognition system in Italy and MP proposes moratorium,https://reclaimyourface.eu/italy-dpa-blocks-facial-recognition-system-mp-proposes-moratorium/,2021-05-02 08:30:58
44,AI Dungeon public disclosure vulnerability report,https://github.com/AetherDevSecOps/aid_adventure_vulnerability_report,2021-05-02 08:31:05
45,Mining robot stranded on Pacific Ocean floor in deep-sea mining trial,https://www.reuters.com/business/environment/mining-robot-stranded-pacific-ocean-floor-deep-sea-mining-trial-2021-04-28/,2021-05-02 08:31:05
46,The Fourier transform is a neural network,https://sidsite.com/posts/fourier-nets/,2021-05-02 08:31:05
47,U.S. Labor Secretary throws support behind classifying gig workers as employees,https://www.reuters.com/article/us-usa-labor-exclusive/exclusive-u-s-labor-secretary-says-most-gig-workers-should-be-classified-as-employees-idUSKBN2CG1ZS,2021-05-02 08:31:05
48,What We’re Learning About Ingenuity’s Flight Control and Aerodynamic Performance,https://mars.nasa.gov/technology/helicopter/status/298/what-were-learning-about-ingenuitys-flight-control-and-aerodynamic-performance/,2021-05-02 08:31:05
49,"This week in KDE: Support for GPU hot-plug and FreeSync, and so much more",https://pointieststick.com/2021/04/30/this-week-in-kde-support-for-gpu-hot-plug-and-freesync-and-so-much-more/,2021-05-02 08:31:12
50,EU court rules software transfer is a sale (2012),https://bdkadvokati.com/eu-court-rules-software-transfer-is-a-sale/,2021-05-02 08:31:18
51,Google-led paper pushes back against claims of AI inefficiency,https://venturebeat.com/2021/04/29/google-led-paper-pushes-back-against-claims-of-ai-inefficiency/,2021-05-02 08:31:18
52,Coffee drinkers display a distinct pattern of brain functional connectivity,https://www.nature.com/articles/s41380-021-01075-4,2021-05-02 08:31:24
53,The NYPD retires “Digidog” robot after public backlash,https://arstechnica.com/gadgets/2021/04/the-nypd-retires-digidog-robot-after-public-backlash/,2021-05-02 08:31:24
54,Classical Reasoning and Debugging,https://thoughtbot.com/blog/classical-reasoning-and-debugging,2021-05-02 08:31:24
55,The Challenges of Animal Translation,https://www.newyorker.com/science/elements/the-challenges-of-animal-translation,2021-05-02 08:31:24
56,Building a machine learning model to predict the NBA MVP,https://perthirtysix.com/essay/2021-nba-mvp-race,2021-05-02 08:31:31
57,Hallucinogen Persisting Perception Disorder,https://en.wikipedia.org/wiki/Hallucinogen_persisting_perception_disorder,2021-05-02 08:31:31
58,Robotic harvester plucks an Apple every 7 seconds,https://www.freshplaza.com/article/9316228/robotic-harvester-plucks-an-apple-every-7-seconds/,2021-05-02 08:31:56
59,US tells citizens to leave India As Covid Crisis Deepens,https://www.bloomberg.com/news/articles/2021-04-29/u-s-tells-citizens-to-leave-india-as-covid-19-swamps-hospitals,2021-05-02 08:32:02
60,A semantic map of all 3.5M story titles ever submitted to Hacker News,https://twitter.com/clured/status/1387395667618897921,2021-04-29 00:00:29
61,New AI tool calculates materials’ stress and strain based on photos,https://news.mit.edu/2021/ai-materials-stress-strain-0422,2021-04-29 01:00:13
62,A theory of how developers seek information,https://web.eecs.utk.edu/~azh/blog/informationforaging.html,2021-04-29 01:00:13
63,"AI Dungeon will block certain words, review content flagged as inappropriate",https://latitude.io/blog/update-to-our-community-ai-test-april-2021/,2021-04-29 01:00:13
64,Diving Deep on S3 Consistency,https://www.allthingsdistributed.com/2021/04/s3-strong-consistency.html,2021-04-29 01:00:18
65,Supreme Court wary of giving schools broad authority over off-campus speech,https://www.nbcnews.com/politics/supreme-court/supreme-court-wary-giving-schools-broad-authority-over-campus-speech-n1265681,2021-04-29 01:00:18
66,Flower Summit 2021 (The Friendly Federated Learning Framework),https://flower.dev/conf/flower-summit-2021,2021-04-29 01:00:18
67,N.Y.P.D. Robot Dog’s Run Is Cut Short After Fierce Backlash,https://www.nytimes.com/2021/04/28/nyregion/nypd-robot-dog-backlash.html,2021-04-29 01:00:25
68,Geometric Deep Learning,https://geometricdeeplearning.com/,2021-04-29 01:00:25
69,Why AI is harder than we think,https://arxiv.org/abs/2104.12871,2021-04-29 01:00:38
70,Annotated PyTorch implementations of various deep learning normalization layers,https://nn.labml.ai/normalization/index.html,2021-04-29 01:00:38
71,Study shows class bias in hiring based on few seconds of speech,https://news.yale.edu/2019/10/21/yale-study-shows-class-bias-hiring-based-few-seconds-speech,2021-04-29 01:00:44
72,Apple to Ban Apps That Reward Users for Enabling App Tracking,https://www.macrumors.com/2021/04/27/apple-ban-apps-offer-rewards-for-att/,2021-04-29 01:00:50
73,SixtyFPS v0.0.6 GUI Toolkit: Now with IDE Support,https://sixtyfps.io/blog/v0.0.6-now-with-ide-support,2021-04-29 01:00:50
74,Tool can make photos undetectable to facial recognition without ruining them,https://www.dailydot.com/debug/donotpay-photo-ninja-facial-recognition/,2021-04-29 01:00:50
75,Cheerleader’s Snapchat rant leads to ‘momentous’ Supreme Court case on speech,https://www.washingtonpost.com/politics/courts_law/supreme-court-cheerleader-first-amendment/2021/04/25/9d2ac1e2-9eb7-11eb-b7a8-014b14aeb9e4_story.html,2021-04-29 01:00:50
