Index,Title,URL,Time(UTC)
0,Thousands of Tor exit nodes attacked cryptocurrency users over the past year,https://therecord.media/thousands-of-tor-exit-nodes-attacked-cryptocurrency-users-over-the-past-year/,2021-05-09 14:40:49
1,U.S.'s Biggest Gasoline Pipeline Halted After Cyberattack,https://www.washingtonpost.com/business/2021/05/08/cyber-attack-colonial-pipeline/,2021-05-09 14:40:56
2,A Dutch City Gets a €600k Fine for WiFi Tracking,https://hackaday.com/2021/05/08/a-dutch-city-gets-a-e600000-fine-for-wifi-tracking/,2021-05-09 14:41:25
3,Adversarial Reprogramming of Neural Cellular Automata,https://distill.pub/selforg/2021/adversarial,2021-05-09 14:41:30
4,"India holds up wireless approvals for China-made devices, delaying launches",https://www.reuters.com/business/media-telecom/exclusive-india-holds-up-wireless-approvals-china-made-devices-delaying-launches-2021-05-07/,2021-05-09 14:41:47
5,Cyberattack Forces Closure of Largest U.S. Refined-Fuel Pipeline,https://www.wsj.com/articles/cyberattack-forces-closure-of-largest-u-s-refined-fuel-pipeline-11620479737,2021-05-09 14:41:47
6,Cyber attack shuts down U.S. fuel pipeline ‘jugular’,https://www.reuters.com/technology/colonial-pipeline-halts-all-pipeline-operations-after-cybersecurity-attack-2021-05-08/,2021-05-09 14:42:13
7,Cyberattack Forces a Shutdown of a Top U.S. Pipeline Operator,https://www.nytimes.com/2021/05/08/us/cyberattack-colonial-pipeline.html,2021-05-09 14:42:19
