Index,Title,URL,Time(UTC)
0,Play Gesture-Controlled Pong with a Raspberry Pi Pico,https://www.hackster.io/nickbild/pico-pong-280b09,2021-05-11 03:06:19
1,Adversarial Reprogramming of Neural Cellular Automata,https://distill.pub/selforg/2021/adversarial,2021-05-11 03:07:00
2,A Dutch City Gets a €600k Fine for WiFi Tracking,https://hackaday.com/2021/05/08/a-dutch-city-gets-a-e600000-fine-for-wifi-tracking/,2021-05-11 03:07:07
3,Run your ghost blog on Raspberry Pi for free,https://viggy28.dev/article/setting-up-ghost-in-raspberry-pi-for-free/,2021-05-11 03:07:14
4,"India holds up wireless approvals for China-made devices, delaying launches",https://www.reuters.com/business/media-telecom/exclusive-india-holds-up-wireless-approvals-china-made-devices-delaying-launches-2021-05-07/,2021-05-11 03:07:32
